{"unknown_id":"BK-UNK-001","focus_object_id":"BRH-003","statement":"Named executive ownership for mixed physical and assisted access remains unresolved in the governed Banking corpus.","category":"ownership_gap","origin":"Semantic Banking completion report and strategic sales navigation corpus","authority_status":"candidate","lifecycle_status":"Open","created_at":null,"last_reviewed_at":null,"owner":null,"evidence_demand":"Governed account evidence identifying accountable executive roles without inventing names.","linked_objects":[{"id":"BRH-003","type":"hypothesis","source_asset_id":"EK-BANK-RHYP-001"}],"linked_observations":[],"impact_description":"Prevents specific account-action presentation in Increment 1.","provenance":"docs/Semantic_Banking_Completion_Report.md","human_supplied":false,"distinction":"governed_unknown"}
